{
  "$schema": "https://json-schema.org/draft/2020-12/schema",
  "$id": "https://raw.githubusercontent.com/openwallet-foundation-labs/eudiplo/refs/heads/main/schemas/TrustListCreateDto.schema.json",
  "title": "TrustListCreateDto",
  "type": "object",
  "properties": {
    "id": {
      "type": "string"
    },
    "description": {
      "type": "string"
    },
    "keyChainId": {
      "type": "string"
    },
    "entities": {
      "type": "array",
      "items": {
        "type": "object"
      }
    },
    "data": {
      "type": "object",
      "description": "The full trust list JSON (generated LoTE structure)"
    }
  },
  "required": [
    "entities"
  ],
  "additionalProperties": false
}