{
  "id": "580831bc-ef11-43f4-a3be-a2b6bf1b29a3",
  "description": "trust list for pid issuance",
  "keyChainId": "570852d7-7e7f-40af-a0e3-a6ebffd75ed0",
  "entities": [
    {
      "type": "internal",
      "issuerKeyChainId": "dbb65456-c358-46c1-bb5b-c777ef72c1d3",
      "revocationKeyChainId": "dbb65456-c358-46c1-bb5b-c777ef72c1d4",
      "info": {
        "name": "PID Provider",
        "lang": "en"
      }
    }
  ],
  "data": {
    "ListAndSchemeInformation": {
      "LoTEVersionIdentifier": 1,
      "LoTESequenceNumber": 2,
      "LoTEType": "http://uri.etsi.org/19602/LoTEType/EUEAAProvidersList",
      "StatusDeterminationApproach": "http://uri.etsi.org/19602/EUEAAProvidersList/StatusDetn/EU",
      "SchemeTypeCommunityRules": [
        {
          "lang": "en",
          "uriValue": "http://uri.etsi.org/19602/EUEAAProviders/schemerules/EU"
        }
      ],
      "SchemeTerritory": "EU",
      "NextUpdate": "2026-02-01T09:40:29.793Z",
      "SchemeOperatorName": [
        {
          "lang": "en",
          "value": "Root Tenant"
        }
      ],
      "ListIssueDateTime": "2026-01-02T09:40:29.793Z"
    },
    "TrustedEntitiesList": [
      {
        "TrustedEntityInformation": {
          "TEInformationURI": [
            {
              "lang": "en",
              "uriValue": "http://example.com/te-info"
            }
          ],
          "TEName": [
            {
              "lang": "en",
              "value": "PID Provider"
            }
          ],
          "TEAddress": {
            "TEElectronicAddress": [
              {
                "lang": "en",
                "uriValue": "mailto:example@example.com"
              }
            ],
            "TEPostalAddress": [
              {
                "Country": "DE",
                "lang": "en",
                "Locality": "",
                "PostalCode": "",
                "StreetAddress": ""
              }
            ]
          }
        },
        "TrustedEntityServices": [
          {
            "ServiceInformation": {
              "ServiceTypeIdentifier": "http://uri.etsi.org/19602/SvcType/EAA/Issuance",
              "ServiceName": [
                {
                  "lang": "en",
                  "value": "EAA-Issuance-Service"
                }
              ],
              "ServiceDigitalIdentity": {
                "X509Certificates": [
                  {
                    "val": "MIIBbzCCARagAwIBAgIBATAKBggqhkjOPQQDAjAWMRQwEgYDVQQDEwtSb290IFRlbmFudDAeFw0yNjAxMDIwOTIzMjJaFw0yNzAxMDIwOTIzMjJaMBYxFDASBgNVBAMTC1Jvb3QgVGVuYW50MFkwEwYHKoZIzj0CAQYIKoZIzj0DAQcDQgAEHHkkbUgKSkkqXmL8utl+TLWIg8CYQS4WPJ8j/nO44YzU0ljQtPeYS65wtAJklY2sDt9VbzKlHhl/ly67zk2NLKNVMFMwIgYDVR0RBBswGYIXc2VydmljZS5ldWRpLXdhbGxldC5kZXYwDgYDVR0PAQH/BAQDAgWgMB0GA1UdDgQWBBRvQX4DfNolj/xERsq6Mnn0LJ1LZDAKBggqhkjOPQQDAgNHADBEAiAv/7ZiDe2XT+7GNMQGWbEr+IakJ2Y5EMnur10iLIhVZQIgKrri3W2Bq2qSVyiF0w8v+NwM7Iej3vWwt95KZ2EZ1Cg="
                  }
                ]
              }
            }
          },
          {
            "ServiceInformation": {
              "ServiceName": [
                {
                  "lang": "en",
                  "value": "EAA-Revocation-Service"
                }
              ],
              "ServiceTypeIdentifier": "http://uri.etsi.org/19602/SvcType/EAA/Revocation",
              "ServiceDigitalIdentity": {
                "X509Certificates": [
                  {
                    "val": "MIIBcDCCARagAwIBAgIBATAKBggqhkjOPQQDAjAWMRQwEgYDVQQDEwtSb290IFRlbmFudDAeFw0yNjAxMDIwODQwNDFaFw0yNzAxMDIwODQwNDFaMBYxFDASBgNVBAMTC1Jvb3QgVGVuYW50MFkwEwYHKoZIzj0CAQYIKoZIzj0DAQcDQgAEjl97bi6xKezsht0gbbRpkprPE7Ib926KL7MCbnHtnoGNCEJmvdXuaZm86HO1S6T0+QgH8XyC+8FRNGssEDxkQKNVMFMwIgYDVR0RBBswGYIXc2VydmljZS5ldWRpLXdhbGxldC5kZXYwDgYDVR0PAQH/BAQDAgWgMB0GA1UdDgQWBBQ0c6zxfvAgXDu6ikUlMCge3Yn2LTAKBggqhkjOPQQDAgNIADBFAiEA2/XJ9iirNeYCewMScN2SoGa41T1trYmPfqyqV/BP8+8CIFzOX+GgcnGp4H6qJ3IMueeU8ujXeS3nTHKT6U2yONH6"
                  }
                ]
              }
            }
          }
        ]
      }
    ]
  }
}